1,Diameter of the observable universe,879.9,septillion,24,m,extent,https://en.wikipedia.org/wiki/Observable_universe
2,Diameter of Laniakea supercluster of galaxies,4.92,septillion,24,m,extent,https://en.wikipedia.org/wiki/Laniakea_Supercluster
3,Diameter of our Local Group of galaxies,946,sextillion,21,m,extent,https://en.wikipedia.org/wiki/Local_Group
4,Distance to Andromeda (closest galaxy to the Milky Way),24.22,sextillion,21,m,extent,https://en.wikipedia.org/wiki/Andromeda_Galaxy
5,Diameter of Andromeda (closest galaxy to the Milky Way),2.08,sextillion,21,m,extent,https://en.wikipedia.org/wiki/Andromeda_Galaxy
7,Width of the milky way,1.135,quintillion,21,m,extent,https://en.wikipedia.org/wiki/Milky_Way
6,Distance to Canopus (second brightest star in the night sky),2.94,quintillion,18,m,extent,https://en.wikipedia.org/wiki/Canopus
8,Distance to Sirius (brightest star in the night sky),81.5,quadrillion,15,m,extent,https://en.wikipedia.org/wiki/Sirius
9,Distance to Proxima Centauri (nearest star to the Earth),39.9,quadrillion,15,m,extent,http://imagine.gsfc.nasa.gov/features/cosmic/nearest_star_info.html
10,A parsec,31,quadrillion,15,m,extent,http://imagine.gsfc.nasa.gov/resources/dict_jp.html#parsec
11,A light year,9.46,quadrillion,15,m,extent,http://imagine.gsfc.nasa.gov/resources/dict_jp.html#light_year
12,Distance to the Oort Cloud,748,trillion,12,m,extent,https://en.wikipedia.org/wiki/Oort_cloud
13,Distance to the Heliopause (limit of the Solar System),17.95,trillion,12,m,extent,https://en.wikipedia.org/wiki/Heliosphere
14,Distance to Eris (dwarf planet),10.166,trillion,12,m,extent,https://en.wikipedia.org/wiki/Eris_(dwarf_planet)
15,Distance to Makemake (dwarf planet),6.868,trillion,12,m,extent,https://en.wikipedia.org/wiki/Makemake
16,Distance to Haumea (dwarf planet),6.465,trillion,12,m,extent,https://en.wikipedia.org/wiki/Haumea
17,Distance to Pluto (dwarf planet),5.915,trillion,12,m,extent,https://en.wikipedia.org/wiki/Pluto
18,Halley's comet's furthest distance from the sun (aphelion),5.25,trillion,12,m,extent,https://en.wikipedia.org/wiki/Halley%27s_Comet
19,Distance from the Sun to Neptune,4.498,trillion,12,m,extent,Thanks to Google
20,Length (circumference) of Earth's orbit around the Sun,940,billion,9,m,extent,https://en.wikipedia.org/wiki/Earth%27s_orbit
21,Distance from the Earth to the Sun,149.6,billion,9,m,extent,Thanks to Google
22,An AU (astronomical unit),149.6,billion,9,m,extent,https://en.wikipedia.org/wiki/Astronomical_unit
23,Diameter of the Sun,1.3914,billion,9,m,extent,https://en.wikipedia.org/wiki/Sun
24,Distance from the Earth to the Moon,384.4,million,6,m,extent,Thanks to Google
25,Diameter of Saturn's rings,282,million,6,m,extent,http://solarsystem.nasa.gov/planets/saturn/rings
26,Diameter of Jupiter,139.8,million,6,k,extent,https://en.wikipedia.org/wiki/Jupiter
27,Diameter of Saturn,116.4,million,6,m,extent,https://en.wikipedia.org/wiki/Saturn
28,Diameter of Uranus,50.7,million,6,m,extent,https://en.wikipedia.org/wiki/Uranus
29,Diameter of Neptune,49.2,million,6,m,extent,https://en.wikipedia.org/wiki/Neptune
30,Length of the equator,40.075,million,6,m,extent.hor,Thanks to Google
31,Altitude of a geosynchronous orbit of a satellite around the Earth,35.786,million,6,m,extent.ver,https://en.wikipedia.org/wiki/Geosynchronous_orbit
32,Range of an Airbus A380,15.2,million,6,m,extent.hor,http://www.airbus.com/aircraftfamilies/passengeraircraft/a380family/specifications/
33,Diameter of the Earth,12.76,million,6,m,extent,http://imagine.gsfc.nasa.gov/features/cosmic/earth.html
34,Diameter of Venus,12.014,million,6,m,extent,http://nssdc.gsfc.nasa.gov/planetary/factsheet/
35,Length of the Trans-Siberian Highway from St Petersburg to Vladivostok,11,million,6,m,extent.hor,http://www.roadtraffic-technology.com/features/feature-the-worlds-longest-highways/
36,Length of the Trans-Siberian Railway from Moscow to Vladivostok,9.29,million,6,m,extent.hor,https://en.wikipedia.org/wiki/Trans-Siberian_Railway
37,Length of the 2016 Dakar Rally,9.237,million,6,m,extent.hor,https://en.wikipedia.org/wiki/2016_Dakar_Rally
38,Length of the USA / Canada border,8.891,million,6,m,extent.hor,Thanks to Google
39,Length of the Great Wall of China,8.852,million,6,m,extent.hor,Thanks to Google
40,Length of North America (North to South),8.605,million,6,m,extent.hor,http://www.worldatlas.com/webimage/countrys/nalandst.htm#page
41,Length of Africa (North to South),8,million,6,m,extent.hor,https://en.wikipedia.org/wiki/Geography_of_Africa
42,Length of the Trans-Canada Highway from Victoria to St John's City,7.821,million,6,m,extent.hor,http://www.roadtraffic-technology.com/features/feature-the-worlds-longest-highways/
43,Direct distance from Cape Town to Cairo,7.248,million,6,m,extent.hor,https://www.freemaptools.com/how-far-is-it-between-cape-town_-south-africa-and-cairo_-egypt.htm
44,Length of South America (North to South),7.149,million,6,m,extent.hor,http://www.worldatlas.com/webimage/countrys/salandst.htm
45,Length of the Amazon River,6.992,million,6,m,extent.hor,https://en.wikipedia.org/wiki/List_of_rivers_by_length
46,Length of the Nile River,6.853,million,6,m,extent.hor,https://en.wikipedia.org/wiki/Nile
47,Length of the Kazakhstan-Russia border,6.846,million,6,m,extent.hor,https://en.wikipedia.org/wiki/Kazakhstan%E2%80%93Russia_border
48,Diameter of Mars,6.792,million,6,m,extent,http://nssdc.gsfc.nasa.gov/planetary/factsheet/
49,Mean Radius of the Earth,6.371,million,6,m,extent.ver,https://en.wikipedia.org/wiki/Earth_radius
50,Length of the Yangtze River,6.3,million,6,m,extent.hor,https://en.wikipedia.org/wiki/Yangtze
51,Distance from London to New York,5.576,million,6,m,extent.hor,Thanks to Distance To From
52,Length of the Siberian Yenisei River,5.539,million,6,m,extent.hor,https://en.wikipedia.org/wiki/Yenisei_River
53,Length of Yellow River (Huang He) in China,5.464,million,6,m,extent.hor,https://en.wikipedia.org/wiki/Yellow_River
54,Length of the Argentina-Chile border,5.15,million,6,m,extent.hor,https://en.wikipedia.org/wiki/Argentina%E2%80%93Chile_border
55,Diameter of Mercury,4.879,million,6,m,extent,http://nssdc.gsfc.nasa.gov/planetary/factsheet/
56,Length of I-90 highway from Boston to Seattle,4.86,million,6,m,extent.hor,http://www.roadtraffic-technology.com/features/feature-the-worlds-longest-highways/
57,Length of the Congo River,4.7,million,6,m,extent.hor,Thanks to Google
58,Length of the Mekong River,4.35,million,6,m,extent.hor,https://en.wikipedia.org/wiki/List_of_rivers_by_length
59,Length of Chile - North-South,4.27,million,6,m,extent.hor,https://en.wikipedia.org/wiki/Geography_of_Chile
60,Length of the China-Russia border,4.209,million,6,m,extent.hor,https://en.wikipedia.org/wiki/China%E2%80%93Russia_border
61,Width of Australia,4,million,6,m,extent.hor,http://www.ask.com/geography/many-miles-wide-australia-41036d80355d0566
62,Length of Route 66 from Chicago to Los Angeles,3.94,million,6,m,extent.hor,http://www.route66guide.com
63,Length of the Mississippi River,3.73,million,6,m,extent.hor,Thanks to Wikipedia
64,Length of the Murray-Darling River in Australia,3.672,million,6,m,extent.hor,https://en.wikipedia.org/wiki/List_of_rivers_by_length
65,Length of the Volga River in Russia,3.645,million,6,m,extent.hor,https://en.wikipedia.org/wiki/List_of_rivers_by_length
66,Diameter of Earth's Moon,3.475,million,6,m,extent,http://nssdc.gsfc.nasa.gov/planetary/factsheet/
67,Length of the Indus River,3.18,million,6,m,extent.hor,https://en.wikipedia.org/wiki/List_of_rivers_by_length
68,Length of the Rio Grande (USA; Mexico),3.057,million,6,m,extent.hor,https://en.wikipedia.org/wiki/List_of_rivers_by_length
69,Length of the Danube River,2.88,million,6,m,extent.hor,https://en.wikipedia.org/wiki/List_of_rivers_by_length
70,Length of the Zambezi River,2.574,million,6,m,extent.hor,https://en.wikipedia.org/wiki/Zambezi
71,Length of the Tigris River,1.95,million,6,m,extent.hor,https://en.wikipedia.org/wiki/List_of_rivers_by_length
72,Length of the Limpopo River,1.8,million,6,m,extent.hor,https://en.wikipedia.org/wiki/List_of_rivers_by_length
73,Length of the Beijing-Hangzhou Grand Canal,1.794,million,6,m,extent.hor,https://en.wikipedia.org/wiki/Grand_Canal_(China)
74,Road distance from Land's End to John o' Groats,1.35,million,6,m,extent.hor,https://en.wikipedia.org/wiki/Land%27s_End_to_John_o%27_Groats
75,Length of the Rhine River,1.233,million,6,m,extent.hor,https://en.wikipedia.org/wiki/List_of_rivers_by_length
76,Length of mainland Italy,1.185,million,6,m,extent.hor,http://science.blurtit.com/749871/what-is-the-length-and-width-of-italy
77,Direct distance from Land's End to John o' Groats,970,thousand,3,m,extent.hor,https://en.wikipedia.org/wiki/Land%27s_End_to_John_o%27_Groats
78,Length of the Indianapolis 500 motor race,805,thousand,3,m,extent.hor,https://en.wikipedia.org/wiki/Indianapolis_500
79,Length of the St Lawrence Seaway Canal system,600,thousand,3,m,extent.hor,https://en.wikipedia.org/wiki/Saint_Lawrence_Seaway
80,Distance from London to Edinburgh,534.7,thousand,3,m,extent.hor,Thanks to FreeMapTools
81,Length of the River Thames,386,thousand,3,m,extent.hor,Thanks to Google
82,Length of the British Grand Prix Formula 1 motor race,306.3,thousand,3,m,extent.hor,https://en.wikipedia.org/wiki/British_Grand_Prix
83,Length of the Suez Canal,193.3,thousand,3,m,extent.hor,https://en.wikipedia.org/wiki/Suez_Canal
84,Length of the M25 Orbital motorway around London,188,thousand,3,m,extent.hor,https://en.wikipedia.org/wiki/M25_motorway
85,Diameter of the (fictional) Death Star in the first Star Wars movie,120,thousand,3,m,extent,http://starwars.wikia.com/wiki/Death_Star
86,Length of Hadrian's Wall in Northern England,117.5,thousand,3,m,extent.hor,https://en.wikipedia.org/wiki/Hadrian%27s_Wall
87,Length of the Kiel Canal,98,thousand,3,m,extent.hor,https://en.wikipedia.org/wiki/Kiel_Canal
88,Length of the Panama Canal,77,thousand,3,m,extent.hor,https://en.wikipedia.org/wiki/Panama_Canal
89,Full length of Broadway,53,thousand,3,m,extent.hor,https://en.wikipedia.org/wiki/Broadway_(Manhattan)
90,Length of a Marathon race,42.195,thousand,3,m,extent.hor,Thanks to Google
91,Highest freefall parachute jump (2014),41.425,thousand,3,m,extent.ver,https://www.theverge.com/2014/10/24/7062023/alan-eustace-google-vp-free-fall-parachute-jump-world-record
92,Length of the Peripherique around Paris,35.04,thousand,3,m,extent.hor,https://en.wikipedia.org/wiki/Boulevard_P%C3%A9riph%C3%A9rique
93,Narrowest width of the English Channel,32.3,thousand,3,m,extent.hor,https://en.wikipedia.org/wiki/English_Channel
94,Highest ascent by a propellor-driven aircraft (2001),29.524,thousand,3,m,extent.ver,https://en.wikipedia.org/wiki/Flight_altitude_record
95,Length of Manhattan Island,21.6,thousand,3,m,extent.hor,https://en.wikipedia.org/wiki/Manhattan
96,Length of the Marina beach in Chennai; India,13,thousand,3,m,extent.hor,https://en.wikipedia.org/wiki/Marina_Beach
97,Depth of Marianas Trench,10.994,thousand,3,m,extent.ver,http://geology.com/records/deepest-part-of-the-ocean.shtml
98,Length of the longest canal tunnel (Rove Tunnel in France),7.12,thousand,3,m,extent.hor,https://en.wikipedia.org/wiki/Rove_Tunnel
99,Length of the Oxford-Cambridge boat race,6.8,thousand,3,m,extent.hor,http://theboatraces.org/the-course
100,Highest ascent by a hot air balloon (2004),6.614,thousand,3,m,extent.ver,https://en.wikipedia.org/wiki/Flight_altitude_record
101,Height of Mount Kilimanjaro,5.895,thousand,3,m,extent.ver,https://en.wikipedia.org/wiki/Mount_Kilimanjaro
102,Highest altitude reached by a single kite,4.8795,thousand,3,m,extent.ver,http://www.guinnessworldrecords.com/world-records/highest-altitude-by-a-single-kite/
103,Length of Central Park (NYC),4,thousand,3,m,extent.hor,http://www.ask.com/geography/big-central-park-new-york-city-3fd1d686bd03643
104,Length of the Copacabana beach in Rio de Janeiro,4,thousand,3,m,extent.hor,https://en.wikipedia.org/wiki/Copacabana;_Rio_de_Janeiro
105,Depth of the Mponeng Gold Mine (South Africa),3.9,thousand,3,m,extent.ver,http://www.mining-technology.com/features/feature-top-ten-deepest-mines-world-south-africa/
106,Length of the Epsom Derby horse race,2.4,thousand,3,m,extent.hor,https://en.wikipedia.org/wiki/Epsom_Downs_Racecourse
107,Length of the Kentucky Derby horse race,2,thousand,3,m,extent.hor,https://en.wikipedia.org/wiki/Kentucky_Derby
108,Length of the Champs Elysee,1.9,thousand,3,m,extent.hor,https://www.google.co.uk/webhp?sourceid=chrome-instant&ion=1&espv=2&ie=UTF-8#q=length%20of%20champs%20elysees
109,Length of Tiananmen square in Beijing,880,unit,0,m,extent.hor,http://tiananmensquarebeijing.com
110,Length of the Lincoln Memorial Reflecting pool in Washington DC,618,unit,0,m,extent.hor,https://en.wikipedia.org/wiki/Lincoln_Memorial_Reflecting_Pool
111,Height of the CN Tower in Toronto,553.3,unit,0,m,extent.ver,https://en.wikipedia.org/wiki/CN_Tower
112,Height of the `One World Trade Center` skyscraper in New York City,541.3,unit,0,m,extent.ver,https://en.wikipedia.org/wiki/One_World_Trade_Center
113,World record longest flight of an arrow from a bow (2010),484.29,unit,0,m,extent.hor,http://news.bbc.co.uk/local/northampton/hi/people_and_places/history/newsid_8924000/8924976.stm
114,Longest golf drive,470.9,unit,0,m,extent.hor,http://news.bbc.co.uk/1/hi/programmes/click_online/9269507.stm
115,Length of a TI Class oil tanker,380,unit,0,m,extent.hor,https://en.wikipedia.org/wiki/List_of_longest_ships
116,Length of the USS Gerald R. Ford supercarrier,337,unit,0,m,extent.hor,https://en.wikipedia.org/wiki/USS_Gerald_R._Ford
117,Length of the USS Nimitz supercarrier,333,unit,0,m,extent.hor,https://en.wikipedia.org/wiki/Supercarrier
118,Length of the Titanic,269,unit,0,m,extent.hor,https://en.wikipedia.org/wiki/RMS_Titanic
119,Length of the longest ski jump ever (2015),251.5,unit,0,m,extent.hor,https://en.wikipedia.org/wiki/List_of_the_longest_ski_jumps
120,Length of Tower Bridge over the Thames,244,unit,0,m,extent.hor,https://en.wikipedia.org/wiki/Tower_Bridge
121,Length of the Pont Neuf bridge over the Seine,232,unit,0,m,extent.hor,https://en.wikipedia.org/wiki/Pont_Neuf
122,Height of the Hoover dam wall,221.4,unit,0,m,extent.ver,https://en.wikipedia.org/wiki/Hoover_Dam
123,Height of the minaret of Hassan II Mosque in Casablanca,210,unit,0,m,extent.ver,https://en.wikipedia.org/wiki/Minaret
124,Height of the Gateway Arch in St Louis,192,unit,0,m,extent.ver,https://en.wikipedia.org/wiki/Gateway_Arch
125,Height of the Space Needle in Seattle,184,unit,0,m,extent.ver,https://en.wikipedia.org/wiki/Space_Needle
126,Height of Sagrada Familia Basilica in Barcelona,170,unit,0,m,extent.ver,https://en.wikipedia.org/wiki/Sagrada_Família
127,Height of the Washington Monument in Washington; DC,169,unit,0,m,extent.ver,https://en.wikipedia.org/wiki/Washington_Monument
128,Height of Ulm Minster; Germany,161.5,unit,0,m,extent.ver,https://en.wikipedia.org/wiki/List_of_tallest_church_buildings
129,Height of Kingda Ka roller coaster,139,unit,0,m,extent.ver,https://en.wikipedia.org/wiki/List_of_roller_coaster_rankings
130,Height of the Great Pyramid of Giza,139,unit,0,m,extent.ver,https://en.wikipedia.org/wiki/Great_Pyramid_of_Giza
131,Height of the spire of Salisbury cathedral,123,unit,0,m,extent.ver,https://en.wikipedia.org/wiki/Salisbury_Cathedral
132,Height of the tallest Coast Redwood tree (California; USA),115.61,unit,0,m,extent.ver,https://en.wikipedia.org/wiki/List_of_superlative_trees
133,Height of St Paul's Cathedral in London,111,unit,0,m,extent.ver,https://en.wikipedia.org/wiki/St_Paul%27s_Cathedral
134,Length of the Saturn V Apollo Program launch rocket,110.6,unit,0,m,extent.ver,https://en.wikipedia.org/wiki/Saturn_V
135,Length of an American Football field,110,unit,0,m,extent.hor,https://en.wikipedia.org/wiki/American_football
136,Height of the Victoria Falls (Mosi-oa-Tunya) between Zambia and Zimbabwe,108,unit,0,m,extent.ver,https://en.wikipedia.org/wiki/Victoria_Falls
137,Length of a football pitch,105,unit,0,m,extent.hor,Thanks to Wikipedia
138,World record javelin throw,104.8,unit,0,m,extent.hor,https://en.wikipedia.org/wiki/Men%27s_javelin_throw_world_record_progression
139,Length overall of the Cutty Sark sailing ship,85.4,unit,0,m,extent.hor,http://www.rmg.co.uk/cutty-sark/history/cutty-sark-construction-facts-figures
140,Wingspan of an Airbus A380,79.75,unit,0,m,extent.hor,http://www.airbus.com/aircraftfamilies/passengeraircraft/a380family/specifications/
141,Longest ever discus throw,74.08,unit,0,m,extent.hor,https://en.wikipedia.org/wiki/Discus_throw
142,Height of the Taj Mahal in Agra; India,73,unit,0,m,extent.ver,https://en.wikipedia.org/wiki/Taj_Mahal
143,Length of the Great Sphinx of Giza,73,unit,0,m,extent.hor,https://en.wikipedia.org/wiki/Great_Sphinx_of_Giza
144,Overall length of an Airbus A380,72.72,unit,0,m,extent.hor,http://www.airbus.com/aircraftfamilies/passengeraircraft/a380family/specifications/
145,Length of a Boeing 747 airliner,70.66,unit,0,m,extent.hor,https://en.wikipedia.org/wiki/Boeing_747-400
146,Length of the SpaceX Falcon 9 launch rocket,70,unit,0,m,extent.ver,https://en.wikipedia.org/wiki/Falcon_9
147,Wingspan of a Boeing 747 airliner,64.44,unit,0,m,extent.hor,https://en.wikipedia.org/wiki/Boeing_747-400
148,Length of an ice-hockey rink,61,unit,0,m,extent.hor,https://en.wikipedia.org/wiki/Ice_hockey_rink#Goal_posts_and_nets
149,Height of Niagara Falls,57,unit,0,m,extent.ver,http://www.niagaraparks.com/about-niagara-falls/geology-facts-figures.html
150,Height of the Leaning Tower of Pisa,56.67,unit,0,m,extent.ver,https://en.wikipedia.org/wiki/Leaning_Tower_of_Pisa
151,Typical flight of a flying fish,50,unit,0,m,extent.hor,https://en.wikipedia.org/wiki/Flying_fish
152,Height of St Basil's Cathedral in Moscow,47.5,unit,0,m,extent.ver,https://en.wikipedia.org/wiki/Saint_Basil%27s_Cathedral
153,Height of the main mast of the Cutty Sark sailing ship,47,unit,0,m,extent.ver,http://www.rmg.co.uk/cutty-sark/history/cutty-sark-construction-facts-figures
154,Initial height of the world's first skyscraper ? the Home Insurance Building,42,unit,0,m,extent.ver,https://en.wikipedia.org/wiki/Home_Insurance_Building
155,Length of the Millennium Falcon spaceship in the Star Wars movies,34.75,unit,0,m,extent.hor,http://starwars.wikia.com/wiki/Millennium_Falcon
156,Estimated length of Diplodocus hallorum (longest dinosaur),33.5,unit,0,m,extent.hor,https://en.wikipedia.org/wiki/Diplodocus
157,Length of a blue whale,30,unit,0,m,extent.hor,https://en.wikipedia.org/wiki/Blue_whale
158,Height of the `Christ the Redeemer` statue in Rio de Janeiro,30,unit,0,m,extent.ver,https://en.wikipedia.org/wiki/Christ_the_Redeemer_(statue)
159,Length of a basketball court,28,unit,0,m,extent.hor,https://en.wikipedia.org/wiki/Basketball
160,Distance between bases of a baseball diamond,27.432,unit,0,m,extent.hor,Thanks to Wikipedia
,Length of the Blue Whale skeleton in London's Natural History Museum,25.2,unit,0,m,extent.hor,http://www.nhm.ac.uk/about-us/news/2017/july/museum-unveils-hope-the-blue-whale-skeleton.html?utm_source=fb-image-post-20170713&utm_medium=social&utm_campaign=hintze-hall
161,Length of a tennis court,23.77,unit,0,m,extent.hor,http://www.tennisplanet.co.uk/other/information/dimensions-of-a-court/
162,Height of an All-Terrain Armored Transport (AT-AT) in Star Wars movies,22.5,unit,0,m,extent.ver,http://starwars.wikia.com/wiki/All_Terrain_Armored_Transport
163,Height of the Great Sphinx of Giza,20.21,unit,0,m,extent.ver,https://en.wikipedia.org/wiki/Great_Sphinx_of_Giza
164,Length of a cricket pitch,20.12,unit,0,m,extent.hor,Thanks to Google
165,Men's Olympic Triple Jump record,18.09,unit,0,m,extent.hor,https://en.wikipedia.org/wiki/List_of_Olympic_records_in_athletics
166,Length of a London Underground carriage,18,unit,0,m,extent.hor,https://en.wikipedia.org/wiki/London_Underground_rolling_stock
167,Height of the US Presidents' heads carved into Mount Rushmore,18,unit,0,m,extent.ver,https://en.wikipedia.org/wiki/Mount_Rushmore
168,Women's Olympic Triple Jump record,15.39,unit,0,m,extent.hor,https://en.wikipedia.org/wiki/List_of_Olympic_records_in_athletics
169,Width of a basketball court,15,unit,0,m,extent.hor,https://en.wikipedia.org/wiki/Basketball
170,Distance a kangaroo can jump,13.5,unit,0,m,extent.hor,http://www.answers.com/Q/How_far_can_a_kangaroo_jump
171,Length of a T-65 X-Wing starfighter in the Star Wars movies,12.5,unit,0,m,extent.hor,http://starwars.wikia.com/wiki/T-65_X-wing_starfighter
172,Estimated length of Tyrannosaurus Rex,12.3,unit,0,m,extent.hor,https://en.wikipedia.org/wiki/Tyrannosaurus
173,Length of a London bus,11.23,unit,0,m,extent.hor,Thanks to Google
174,Height of a high-diving platform,10,unit,0,m,extent.ver,https://en.wikipedia.org/wiki/Diving_platform
175,World Long Jump Record (1991),8.95,unit,0,m,extent.hor,https://en.wikipedia.org/wiki/Long_jump_world_record_progression
176,Men's Olympic Long Jump record,8.9,unit,0,m,extent.hor,https://en.wikipedia.org/wiki/List_of_Olympic_records_in_athletics
177,Women's Olympic Long Jump record,7.4,unit,0,m,extent.hor,https://en.wikipedia.org/wiki/List_of_Olympic_records_in_athletics
178,Width of a football goal,7.32,unit,0,m,extent.hor,https://en.wikipedia.org/wiki/Football_pitch
179,Maximum length of a Reticulated Python,6.5,unit,0,m,extent,https://en.wikipedia.org/wiki/Reticulated_python
180,World Pole Vault Record (2014),6.16,unit,0,m,extent.ver,https://en.wikipedia.org/wiki/Men%27s_pole_vault_world_record_progression
181,Men's Olympic Pole Vault record,5.97,unit,0,m,extent.ver,https://en.wikipedia.org/wiki/List_of_Olympic_records_in_athletics
182,Height of the Lincoln statue in the Lincoln Memorial in Washington; DC,5.8,unit,0,m,extent.ver,https://en.wikipedia.org/wiki/Abraham_Lincoln_(1920_statue)
183,Women's Olympic Pole Vault record,5.05,unit,0,m,extent.ver,https://en.wikipedia.org/wiki/List_of_Olympic_records_in_athletics
184,Length of a classic Ford Mustang (first generation) car,4.613,unit,0,m,extent.hor,https://en.wikipedia.org/wiki/Ford_Mustang_(first_generation)
185,Length of a typical Great White Shark,4.6,unit,0,m,extent.hor,https://en.wikipedia.org/wiki/Great_white_shark
186,Length of a Nile crocodile,4.2,unit,0,m,extent.hor,Thanks to Google
187,Length of a classic Volkswagen `Beetle` car,4.079,unit,0,m,extent.hor,https://en.wikipedia.org/wiki/Volkswagen_Beetle
188,Length of a standard full size snooker table,3.569,unit,0,m,extent.hor,Thanks to Google
189,Wingspan of a Wandering Albatross,3.1,unit,0,m,extent.hor,https://en.wikipedia.org/wiki/Wandering_albatross
190,Height of a basketball hoop,3.048,unit,0,m,extent.ver,https://en.wikipedia.org/wiki/Basketball
191,World High Jump Record (1993),2.45,unit,0,m,extent.ver,https://en.wikipedia.org/wiki/Men%27s_high_jump_world_record_progression
192,Height of a football goal,2.44,unit,0,m,extent.ver,https://en.wikipedia.org/wiki/Football_pitch
193,Men's Olympic High Jump record,2.39,unit,0,m,extent.ver,https://en.wikipedia.org/wiki/List_of_Olympic_records_in_athletics
194,Height of Chewbacca in the Star Wars movies,2.21,unit,0,m,extent.ver,https://en.wikipedia.org/wiki/Peter_Mayhew
195,Women's Olympic High Jump record,2.06,unit,0,m,extent.ver,https://en.wikipedia.org/wiki/List_of_Olympic_records_in_athletics
196,Length of a `king-size` bed,1.98,unit,0,m,extent.hor,http://www.bedtimesuperstores.co.uk/blog/post/uk-standard-bed-sizes-and-dimensions/
197,Length of a standard bed,1.9,unit,0,m,extent.hor,http://www.bedtimesuperstores.co.uk/blog/post/uk-standard-bed-sizes-and-dimensions/
198,Width of a ice-hockey goal,1.8,unit,0,m,extent.hor,https://en.wikipedia.org/wiki/Ice_hockey_rink#Goal_posts_and_nets
199,Height of a ice-hockey goal,1.2,unit,0,m,extent.ver,https://en.wikipedia.org/wiki/Ice_hockey_rink#Goal_posts_and_nets
200,Length of a lightsaber in the Star Wars movies,1.19,unit,0,m,extent,https://en.wikipedia.org/wiki/Lightsaber
201,Height of the R2-D2 droid in the Star Wars movies,1.09,unit,0,m,extent.ver,http://starwars.wikia.com/wiki/R2-D2
202,Height of an Olympic hurdle,1.067,unit,0,m,extent.ver,https://en.wikipedia.org/wiki/110_metres_hurdles
203,Maximum length of a baseball bat,1.067,unit,0,m,extent,https://www.google.co.uk/search?client=opera&q=length+of+a+baseball+bat&sourceid=opera&ie=UTF-8&oe=UTF-8
204,Maximum length of a cricket bat,0.965,unit,0,m,extent,https://en.wikipedia.org/wiki/Cricket_bat
205,Height of a tennis net at the centre,0.914,unit,0,m,extent.ver,http://officialtennisrules.com/official-tennis-court-dimensions/
206,Height of a standard washing machine,0.85,unit,0,m,extent.ver,http://www.whitegoodshelp.co.uk/are-all-washing-machines-the-same-size/
207,Maximum length of a tennis racket,0.737,unit,0,m,extent,http://officialtennisrules.com/official-dimensions-for-tennis-rackets/
208,Length of a tenor saxophone,0.71,unit,0,m,extent,http://www.ehow.com/info_8275964_sizes-sax-vs-alto-sax.html
209,Height of BB-8 droid in Star Wars movies,0.67,unit,0,m,extent.ver,http://starwars.wikia.com/wiki/BB-8
210,Height of Yoda in the Star Wars movies,0.66,unit,0,m,extent.ver,http://starwars.wikia.com/wiki/Yoda
211,Maximum length of carry-on luggage (per United Airlines),0.56,unit,0,m,extent.hor,https://www.united.com/CMS/en-US/travel/Pages/BaggageCarry-On.aspx
212,Side of a classic Monopoly board,0.508,unit,0,m,extent,http://www.answers.com/Q/What_is_the_size_of_a_monopoly_board?#slide=2
213,Diameter of a regulation dartboard,0.451,unit,0,m,extent,https://en.wikipedia.org/wiki/Darts#Dartboard
214,Length of US Legal page of paper,0.356,unit,0,m,extent,http://www.papersizes.org/a4-foolscap-letter.htm
215,Distance a flea can jump,0.33,unit,0,m,extent.hor,https://en.wikipedia.org/wiki/Flea
