215,Maximum length of carry-on luggage (per United Airlines),0.56,unit,0,m,extent.hor,https://www.united.com/CMS/en-US/travel/Pages/BaggageCarry-On.aspx
216,Side of a classic Monopoly board,0.508,unit,0,m,extent,http://www.answers.com/Q/What_is_the_size_of_a_monopoly_board?#slide=2
217,Diameter of a regulation dartboard,0.451,unit,0,m,extent,https://en.wikipedia.org/wiki/Darts#Dartboard
218,Length of US Legal page of paper,0.356,unit,0,m,extent,http://www.papersizes.org/a4-foolscap-letter.htm
219,Distance a flea can jump,0.33,unit,0,m,extent.hor,https://en.wikipedia.org/wiki/Flea
220,Length of a Foolscap page of paper,0.33,unit,0,m,extent,http://www.papersizes.org/a4-foolscap-letter.htm
221,Length of an A4 page of paper,0.297,unit,0,m,extent,http://www.stephenwiltshire.co.uk/paper_sizes.aspx
222,Height of a standard Barbie doll,0.292,unit,0,m,extent,https://answers.yahoo.com/question/index?qid=20090219105917AA4HwR6
223,Height of a standard wine bottle,0.291,unit,0,m,extent.ver,http://ezinearticles.com/?The-Dimensions-of-a-Wine-Bottle&id=7915289
224,Length of a standard DL business envelope,0.22,unit,0,m,extent,https://en.wikipedia.org/wiki/Envelope#International_standard_sizes
225,Length of a pencil,0.19,unit,0,m,extent,https://en.wikipedia.org/wiki/Pencil
226,Length of a Penguin paperback book,0.181,unit,0,m,extent,https://en.wikipedia.org/wiki/Penguin_Composition_Rules
227,Length of a Samsung Galaxy S8+ smartphone,0.1595,unit,0,m,extent,http://www.samsung.com/global/galaxy/galaxy-s8/specs/
228,Length of an iPhone 7 plus,0.1582,unit,0,m,extent,http://www.gsmarena.com/apple_iphone_7_plus-8065.php
229,Length of an iPhone 6,0.1581,unit,0,m,extent,Thanks to Google
230,Length of USA dollar bill,0.156,unit,0,m,extent,http://www.enchantedlearning.com/math/money/bills/one/
231,Length of a Pixel XL smartphone,0.1547,unit,0,m,extent,https://madeby.google.com/phone/specs/
232,Length of a BIC Cristal pen,0.149,unit,0,m,extent,https://en.wikipedia.org/wiki/Bic_Cristal
233,Length of a standard index card,0.127,unit,0,m,extent,https://en.wikipedia.org/wiki/Index_card
234,Length of an iPhone SE,0.1238,unit,0,m,extent,http://www.idownloadblog.com/2016/03/21/hardware-differences-between-iphone-se-and-iphone-6s/
235,Diameter of a CD / DVD,0.12,unit,0,m,extent,http://www.encyclopedia.com/topic/compact_disc.aspx
236,Width of a Penguin paperback book,0.111,unit,0,m,extent,https://en.wikipedia.org/wiki/Penguin_Composition_Rules
237,Length of a standard playing card,0.0889,unit,0,m,extent,https://en.wikipedia.org/wiki/Standard_52-card_deck#Size_of_the_cards
238,Length of a credit card,0.0856,unit,0,m,extent,https://en.wikipedia.org/wiki/ISO/IEC_7810
239,Size of a standard square Post-It note,0.0762,unit,0,m,extent,http://www.post-it.com/3M/en_US/post-it/products/~/Post-it-Products/Notes/?N=4327+5927575+3294529207+3294857497&rt=r3
240,Diameter of regulation baseball,0.0737,unit,0,m,extent,https://en.wikipedia.org/wiki/Baseball_(ball)
241,Diameter of a regulation pool ball,0.05715,unit,0,m,extent,http://www.wpa-pool.com/web/WPA_Tournament_Table_Equipment_Specifications
242,Width of a credit card,0.05398,unit,0,m,extent,https://en.wikipedia.org/wiki/ISO/IEC_7810
243,Length of a standard matchbox,0.047,unit,0,m,extent,http://www.alibaba.com/product-detail/Standard-Size-Safety-Matchbox_139185685.html
244,Minimum diameter of a golf ball,0.04267,unit,0,m,extent,https://en.wikipedia.org/wiki/Golf_ball
245,Diameter of a regulation table tennis ball,0.04,unit,0,m,extent,https://en.wikipedia.org/wiki/Table_tennis#Ball
246,Height of a standard Lego minifig person,0.04,unit,0,m,extent.ver,http://lego.wikia.com/wiki/Minifigure
247,Width of a standard matchbox,0.034,unit,0,m,extent,http://www.alibaba.com/product-detail/Standard-Size-Safety-Matchbox_139185685.html
248,Length of a standard 4 x 2 Lego brick,0.0318,unit,0,m,extent,http://www.robertcailliau.eu/Lego/Dimensions/zMeasurements-en.xhtml
249,Diameter of US dollar coin,0.0265,unit,0,m,extent,https://en.wikipedia.org/wiki/Dollar_coin_(United_States)
250,Diameter of a UK 1p coin,0.0203,unit,0,m,extent,Thanks to Google
251,Diameter of a US 1c coin,0.019,unit,0,m,extent,Thanks to Google
252,Side of a casino-standard dice,0.019,unit,0,m,extent,http://www.dicegamedepot.com/dice-sizes/
253,Width of a standard 4 x 2 Lego brick,0.0158,unit,0,m,extent,http://www.robertcailliau.eu/Lego/Dimensions/zMeasurements-en.xhtml
254,Height of a standard matchbox,0.013,unit,0,m,extent,http://www.alibaba.com/product-detail/Standard-Size-Safety-Matchbox_139185685.html
255,Height of a standard Lego brick,0.0096,unit,0,m,extent,http://www.robertcailliau.eu/Lego/Dimensions/zMeasurements-en.xhtml
